<?xml version="1.0"?>
<!DOCTYPE Mexico SYSTEM "mexico.dtd">
<Mexico>
    <estado>
        <nombre>Espa√±a</nombre>
        <municipio />
        <localidad />
    </estado>
    <estado>
        <nombre>Noruega</nombre>
        <localidad />
    </estado>
    <estado>
        <nombre>Austria</nombre>
        <municipio />
    </estado>
</Mexico>